### ISSUE TITLE
How to diagnose an issue? Unix receiver idles on "Starting ... "

### ISSUE THREAD

**Issue by afparsons** [duncanthrax/scream#100]
I'm excited to try and use `scream` to send audio from a Windows 10 laptop to a Linux server (and then over 3.5mm aux into an audio receiver).

I believe I've gotten `scream` installed on the Windows laptop correctly. (see #98 )
I also believe that I've correctly compiled the unix receiver on my Linux server ([Proxmox](https://www.proxmox.com/en/)).

```
$ lsb_release -a
No LSB modules are available.
Distributor ID:	Debian
Description:	Debian GNU/Linux 10 (buster)
Release:	10
Codename:	buster
```

Using `speaker-test`, I've confirmed that I have audio correctly working.

I can:

- launch YouTube on the Windows machine and set the output device to Scream
- run the scream receiver with various flags

**The scream receiver doesn't seem to be receiving any audio. I'm not sure how to further diagnose the issue.**

My Linux server is a laptop networked via ethernet on `eno1`.  
```
$ ip link
1: lo: <LOOPBACK,UP,LOWER_UP> mtu 65536 qdisc noqueue state UNKNOWN mode DEFAULT group default qlen 1000
    link/loopback 00:00:00:00:00:00 brd 00:00:00:00:00:00
2: eno1: <BROADCAST,MULTICAST,UP,LOWER_UP> mtu 1500 qdisc pfifo_fast master vmbr0 state UP mode DEFAULT group default qlen 1000
    link/ether 10:1f:74:69:a2:88 brd ff:ff:ff:ff:ff:ff
3: enx64d4da6b44df: <NOARP> mtu 1400 qdisc noop state DOWN mode DEFAULT group default qlen 20
    link/ether 64:d4:da:6b:44:df brd ff:ff:ff:ff:ff:ff
4: wlo1: <NO-CARRIER,BROADCAST,MULTICAST,UP> mtu 1500 qdisc mq state DOWN mode DEFAULT group default qlen 1000
    link/ether 40:25:c2:b4:8a:b8 brd ff:ff:ff:ff:ff:ff
5: vmbr0: <BROADCAST,MULTICAST,UP,LOWER_UP> mtu 1500 qdisc noqueue state UP mode DEFAULT group default qlen 1000
    link/ether 10:1f:74:69:a2:88 brd ff:ff:ff:ff:ff:ff
6: tap100i0: <BROADCAST,MULTICAST,PROMISC,UP,LOWER_UP> mtu 1500 qdisc pfifo_fast master vmbr0 state UNKNOWN mode DEFAULT group default qlen 1000
    link/ether 52:7c:1b:aa:cc:22 brd ff:ff:ff:ff:ff:ff

```

Running with `-o alsa` (`pulseaudio` is the same):

```
scream/Receivers/unix/build$ ./scream -i eno1 -v -o alsa
Using ALSA output
Starting multicast receiver
```

What should I try next?

**Comment by duncanthrax** [comment]
Do a tcpdump like ```tcpdump -pni eno1 port 4010``` to see if you get any packets while playing sound. If you don't get any, try unicast (see the README.md on the github frontpage).

**Comment by afparsons** [comment]
I was just about to comment with some tcpdump output! You beat me to it. Thanks for the quick response @duncanthrax .

```
$ sudo tcpdump -pni eno1 port 4010 -c5
tcpdump: verbose output suppressed, use -v or -vv for full protocol decode
listening on eno1, link-type EN10MB (Ethernet), capture size 262144 bytes
16:41:10.195685 IP 10.0.0.57.4010 > 239.255.77.77.4010: UDP, length 1157
16:41:10.196422 IP 10.0.0.57.4010 > 239.255.77.77.4010: UDP, length 1157
16:41:10.205085 IP 10.0.0.57.4010 > 239.255.77.77.4010: UDP, length 1157
16:41:10.214919 IP 10.0.0.57.4010 > 239.255.77.77.4010: UDP, length 1157
16:41:10.215588 IP 10.0.0.57.4010 > 239.255.77.77.4010: UDP, length 1157
5 packets captured
5 packets received by filter
0 packets dropped by kernel
```
I'm definitely receiving the packets. 

Based on the readme...I guess I should use the `-P` libpcap flag?

```
$ sudo apt-get install libpcap0.8 libpcap0.8-dev libpcap-dev
Reading package lists... Done
Building dependency tree       
Reading state information... Done
libpcap-dev is already the newest version (1.8.1-6).
libpcap0.8 is already the newest version (1.8.1-6).
libpcap0.8-dev is already the newest version (1.8.1-6).
0 upgraded, 0 newly installed, 0 to remove and 21 not upgraded.
```

So I would assume I should compile with libpcap available:

```
$ cmake ..
-- Checking for module 'libpcap'
--   No package 'libpcap' found
-- Configuring done
-- Generating done
-- Build files have been written to: /home...<blah blah blah>.../build
```

**Comment by duncanthrax** [comment]
Hmmm, the cmake recipe uses pkg-config to find libpcap. Probably you have this problem:
https://bugs.launchpad.net/ubuntu/+source/libpcap/+bug/1865501

**Comment by martinellimarco** [comment]
@afparsons do you have a firewall enabled?
I don't use Debian but I think you can see it with `sudo systemctl status firewall.service`
If that fail try `sudo systemctl status firewalld.service` or `sudo ufw status`.

**Comment by kaisparkle** [comment]
I'm having a similar issue, except I'm attempting to pass audio up through a Windows VM. Similar setup, except using `libvirt` networking. It's exhibiting the same symptoms as here - packets are clearly received on the host, either through unicast or multicast, but running an strace shows that they aren't reaching the receiver (no activity). 

In my case, I have UFW installed, but the same problem was exhibited even after ports 4010 and 4011 were allowed through, or if UFW was disabled entirely. Not sure how to continue diagnosing from here. As a side note, I haven't been able to get IVSHMEM working either, but that's unrelated to this issue.

**Comment by martinellimarco** [comment]
@kaisparkle What's your distro? For example on Ubuntu I've seen both UFW and firewalld at the same time and even if one was allowing the port the other one wasn't. I banged my head around it for a few days.

Try `sudo systemctl status firewalld.service` and see if it's installed / enabled.

If that's not it look at iptables rules and see what's in there.

UFW is a strange beast. On one hand it's easy to use but its not aware of any rule managed by others. I discovered this the hard way when I configured UFW to deny anything from outside, then installed docker and found out I could happily connect from the outside because docker was managing it's own iptables rules.

**Comment by kaisparkle** [comment]
@martinellimarco I'm on Arch, so I've only got UFW installed at the moment. I'm pretty unfamiliar with iptables, but I've posted the output of `iptables -S` here. https://pastebin.com/0jxpe0Bq

**Comment by martinellimarco** [comment]
Just for testing run the following commands. They'll flush any iptables rule and set it to accept everything. It's temporary and not saved on disk but it will show us if the problem is firewall or not.
```
sudo iptables -t nat -F
sudo iptables -t mangle -F
sudo iptables -F
sudo iptables -X
sudo iptables -P INPUT ACCEPT
sudo iptables -P FORWARD ACCEPT
sudo iptables -P OUTPUT ACCEPT

sudo iptables -S
```

If it doesn't work what kind of virtual interface are you using between host and guest? Also try [this](https://github.com/duncanthrax/scream/issues/60#issuecomment-651048429)

**Comment by kaisparkle** [comment]
No dice there, so it's not the firewall. I already had the suggestions in that post enabled - first thing I tried when I was digging through issues for a solution :)

I'm using virt-manager's default configuration, which is the `virbr0` bridge, with `forward mode="nat"`.

**Comment by martinellimarco** [comment]
Have you tested this with anycast or unicast? Try unicast.

Also since your are using a bridge I think it's worth checking `sudo ebtables -L` which is the ethernet bridge firewall.

**Comment by kaisparkle** [comment]
Yeah, tried with default and I'm using unicast right now with these arguments: `scream -u -p 4011 -i virbr0 -o pulse`

`ebtables -L` output: 
```
Bridge table: filter

Bridge chain: INPUT, entries: 0, policy: ACCEPT

Bridge chain: FORWARD, entries: 0, policy: ACCEPT

Bridge chain: OUTPUT, entries: 0, policy: ACCEPT```

**Comment by martinellimarco** [comment]
can you confirm with any other program that a connection is possible between host and guest? Usually I use netcat for that.

`nc -l -p 4010 -u` on linux
`nc.exe IP_OF_THE_LINUX_BOX 4010 -u` on windows

Type something, you should see it on the other end.

If you don't have netcat try with `python -m SimpleHTTPServer` on linux and on windows open a browser and visit `http://IP_OF_THE_LINUX_BOX`

**Comment by kaisparkle** [comment]
I can send a message with netcat from the Windows 10 guest to the host, but I have to restart netcat on both ends after a message, otherwise it won't be received. Additionally, I can only send to the host, not the other way around.

**Comment by martinellimarco** [comment]
ok, at least we confirmed it's a network problem and not a scream one. In about an hour I'll be at home and I'll be able to setup a new VM with the same virtual NIC you posted above. Let's see if I can reproduce the issue.

**Comment by martinellimarco** [comment]
Sorry @kaisparkle, I can't reproduce the problem.

I've tested with a fresh windows VM with windows firewall disabled but that shouldn't be the problem as you already confirmed you see the packets on the host. For the network I just copied your xml. I've tested with and without UFW enabled. With it enabled I just had to open the port with `ufw allow 4010/udp`. Tested both multicast and unicast.

I'd really like to see the wireshark log if you have the time.

**Comment by kaisparkle** [comment]
I'm not entirely sure how to run Wireshark on the host - I'm using a single GPU configuration, so X is killed on VM start and the GPU is passed over. I can probably reconfigure it with a virtual GPU for testing, but I've got work today (unfortunately :stuck_out_tongue:) so it might be a while.

**Comment by martinellimarco** [comment]
You can use tcpdump from a terminal.

The command should be `tcpdump -s 0 -i virbr0 -w log.pcap`

**Comment by ZanderFoster** [comment]
Hello, I am currently trying to pass audio from my windows vm running under a Ubuntu 20.04 host.
I seem to have the exact same issue as OP, when I run the above commands used to troubleshoot I get the exact same output.  

@martinellimarco if you or anyone else here wants to figure out this issue I'll be the test subject.

P.s I am new to commenting on issues so apologies if I shouldn't comment in a year old issue as I do not know proper etiquette.
